<?xml version="1.0" encoding="UTF-8"?>
<!DOCTYPE family SYSTEM "C:\Users\Yara\Desktop\task xml\dtd of fmaily.dtd">

<family>
	<grandfather>
		<father job="Doctor">
		
			<son age="10" sport="tennis" > ahmed  </son>
			<daughter age="10"> yara </daughter>
			<mother> amina </mother>
		</father>
		
		<uncle>
		
		
		</uncle>
		
		<uncle>
		
		
		</uncle>
		<anut >
		
		</anut>
	</grandfather>
</family>
